{
  "nodes": [
    { "nodeId": "model.a", "resourceType": "model", "dependsOn": [] },
    { "nodeId": "model.b", "resourceType": "model", "dependsOn": ["model.a"] }
  ],
  "selection": {
    "selectedNodeIds": ["model.b"],
    "includeUpstream": true
  },
  "policies": {
    "retry": { "kind": "at-most-N", "maxAttempts": 3 },
    "timeout": { "kind": "budget", "maxSeconds": 60 }
  },
  "observability": {
    "tags": { "tenant": "test" }
  },
  "requestedBy": "user",
  "requestId": "req-1",
  "requestedAtIso": "2026-02-24T00:00:00.000Z"
}
